{
  "name": "Venture-Grade OSS Signals Report \u2014 2025-07-10",
  "repositories": [
    {
      "name": "MediaCrawler",
      "full_name": "NanmiCoder/MediaCrawler",
      "url": null,
      "description": "\u5c0f\u7ea2\u4e66\u7b14\u8bb0 | \u8bc4\u8bba\u722c\u866b\u3001\u6296\u97f3\u89c6\u9891 | \u8bc4\u8bba\u722c\u866b\u3001\u5feb\u624b\u89c6\u9891 | \u8bc4\u8bba\u722c\u866b\u3001B \u7ad9\u89c6\u9891 \uff5c \u8bc4\u8bba\u722c\u866b\u3001\u5fae\u535a\u5e16\u5b50 \uff5c \u8bc4\u8bba\u722c\u866b\u3001\u767e\u5ea6\u8d34\u5427\u5e16\u5b50 \uff5c \u767e\u5ea6\u8d34\u5427\u8bc4\u8bba\u56de\u590d\u722c\u866b | \u77e5\u4e4e\u95ee\u7b54\u6587\u7ae0\uff5c\u8bc4\u8bba\u722c\u866b",
      "score": 0.0,
      "signals": {
        "star_velocity": 0.0,
        "fork_velocity": 0.0,
        "contributor_growth": 0.0,
        "issue_resolution_rate": 0.20689655172413793,
        "commit_frequency": 0.0,
        "novelty_signal": 0.0,
        "founder_signal": 0.0,
        "documentation_quality": 0.0
      },
      "justification": [],
      "metrics": {
        "stars": 0,
        "stars_gained_14d": 0,
        "forks": 0,
        "forks_gained_14d": 0,
        "commits_14d": 0,
        "contributors_30d": 0,
        "avg_issue_resolution_days": 30
      },
      "date_analyzed": "2025-07-10T11:05:30Z",
      "why_matters": "\u2022 star_velocity: 0.0 \u2022 fork_velocity: 0.0 \u2022 contributor_growth: 0.0 \u2022 issue_reso",
      "repo_url": "https://github.com/NanmiCoder/MediaCrawler",
      "stars": 0,
      "forks": 0,
      "ecosystem": "Other",
      "language": "N/A"
    },
    {
      "name": "Folo",
      "full_name": "RSSNext/Folo",
      "url": null,
      "description": "\ud83e\udde1 Follow everything in one place",
      "score": 0.0,
      "signals": {
        "star_velocity": 0.0,
        "fork_velocity": 0.0,
        "contributor_growth": 0.0,
        "issue_resolution_rate": 0.20689655172413793,
        "commit_frequency": 0.0,
        "novelty_signal": 0.0,
        "founder_signal": 0.0,
        "documentation_quality": 0.0
      },
      "justification": [],
      "metrics": {
        "stars": 0,
        "stars_gained_14d": 0,
        "forks": 0,
        "forks_gained_14d": 0,
        "commits_14d": 0,
        "contributors_30d": 0,
        "avg_issue_resolution_days": 30
      },
      "date_analyzed": "2025-07-10T11:05:30Z",
      "why_matters": "\u2022 star_velocity: 0.0 \u2022 fork_velocity: 0.0 \u2022 contributor_growth: 0.0 \u2022 issue_reso",
      "repo_url": "https://github.com/RSSNext/Folo",
      "stars": 0,
      "forks": 0,
      "ecosystem": "Other",
      "language": "N/A"
    },
    {
      "name": "scira",
      "full_name": "zaidmukaddam/scira",
      "url": null,
      "description": "Scira (Formerly MiniPerplx) is a minimalistic AI-powered search engine that helps you find information on the internet and cites it too. Powered by Vercel AI SDK! Search with models like xAI's Grok 3.",
      "score": 0.0,
      "signals": {
        "star_velocity": 0.0,
        "fork_velocity": 0.0,
        "contributor_growth": 0.0,
        "issue_resolution_rate": 0.20689655172413793,
        "commit_frequency": 0.0,
        "novelty_signal": 0.0,
        "founder_signal": 0.0,
        "documentation_quality": 0.0
      },
      "justification": [],
      "metrics": {
        "stars": 0,
        "stars_gained_14d": 0,
        "forks": 0,
        "forks_gained_14d": 0,
        "commits_14d": 0,
        "contributors_30d": 0,
        "avg_issue_resolution_days": 30
      },
      "date_analyzed": "2025-07-10T11:05:30Z",
      "why_matters": "\u2022 star_velocity: 0.0 \u2022 fork_velocity: 0.0 \u2022 contributor_growth: 0.0 \u2022 issue_reso",
      "repo_url": "https://github.com/zaidmukaddam/scira",
      "stars": 0,
      "forks": 0,
      "ecosystem": "Other",
      "language": "N/A"
    },
    {
      "name": "genai-toolbox",
      "full_name": "googleapis/genai-toolbox",
      "url": null,
      "description": "MCP Toolbox for Databases is an open source MCP server for databases.",
      "score": 0.0,
      "signals": {
        "star_velocity": 0.0,
        "fork_velocity": 0.0,
        "contributor_growth": 0.0,
        "issue_resolution_rate": 0.20689655172413793,
        "commit_frequency": 0.0,
        "novelty_signal": 0.0,
        "founder_signal": 0.0,
        "documentation_quality": 0.0
      },
      "justification": [],
      "metrics": {
        "stars": 0,
        "stars_gained_14d": 0,
        "forks": 0,
        "forks_gained_14d": 0,
        "commits_14d": 0,
        "contributors_30d": 0,
        "avg_issue_resolution_days": 30
      },
      "date_analyzed": "2025-07-10T11:05:30Z",
      "why_matters": "\u2022 star_velocity: 0.0 \u2022 fork_velocity: 0.0 \u2022 contributor_growth: 0.0 \u2022 issue_reso",
      "repo_url": "https://github.com/googleapis/genai-toolbox",
      "stars": 0,
      "forks": 0,
      "ecosystem": "Other",
      "language": "N/A"
    },
    {
      "name": "sim",
      "full_name": "simstudioai/sim",
      "url": null,
      "description": "Sim Studio is an open-source AI agent workflow builder. Sim Studio's interface is a lightweight, intuitive way to quickly build and deploy LLMs that connect with your favorite tools.",
      "score": 0.0,
      "signals": {
        "star_velocity": 0.0,
        "fork_velocity": 0.0,
        "contributor_growth": 0.0,
        "issue_resolution_rate": 0.20689655172413793,
        "commit_frequency": 0.0,
        "novelty_signal": 0.0,
        "founder_signal": 0.0,
        "documentation_quality": 0.0
      },
      "justification": [],
      "metrics": {
        "stars": 0,
        "stars_gained_14d": 0,
        "forks": 0,
        "forks_gained_14d": 0,
        "commits_14d": 0,
        "contributors_30d": 0,
        "avg_issue_resolution_days": 30
      },
      "date_analyzed": "2025-07-10T11:05:30Z",
      "why_matters": "\u2022 star_velocity: 0.0 \u2022 fork_velocity: 0.0 \u2022 contributor_growth: 0.0 \u2022 issue_reso",
      "repo_url": "https://github.com/simstudioai/sim",
      "stars": 0,
      "forks": 0,
      "ecosystem": "Other",
      "language": "N/A"
    }
  ],
  "date": "2025-07-10",
  "date_generated": "2025-07-10T11:05:30Z"
}
