{
  "date": "2025-06-10",
  "name": "Weekly GitHub Signals Report \u2014 2025-06-10",
  "date_generated": "2025-06-10T18:09:24Z",
  "repositories": [
    {
      "name": "onlook",
      "full_name": "onlook-dev/onlook",
      "repo_url": "https://github.com/onlook-dev/onlook",
      "description": "The Cursor for Designers \u2022 An Open-Source Visual Vibecoding Editor \u2022 Visually build, style, and edit your React App with AI",
      "score": 4,
      "signals": {
        "commit_surge": 3,
        "star_velocity": 0,
        "team_traction": 0,
        "dev_ecosystem_fit": 1
      },
      "ecosystem": "Frontend",
      "language": "TypeScript",
      "stars": 18020,
      "forks": 1136,
      "why_matters": "93 commits \u2022 typescript language",
      "created_at": "",
      "topics": [],
      "score_change": null,
      "trend": [
        4
      ]
    },
    {
      "name": "nautilus_trader",
      "full_name": "nautechsystems/nautilus_trader",
      "repo_url": "https://github.com/nautechsystems/nautilus_trader",
      "description": "A high-performance algorithmic trading platform and event-driven backtester",
      "score": 4,
      "signals": {
        "commit_surge": 3,
        "star_velocity": 0,
        "team_traction": 0,
        "dev_ecosystem_fit": 1
      },
      "ecosystem": "Other",
      "language": "Python",
      "stars": 8490,
      "forks": 1048,
      "why_matters": "154 commits \u2022 python language",
      "created_at": "",
      "topics": [],
      "score_change": null,
      "trend": [
        4
      ]
    },
    {
      "name": "tensorzero",
      "full_name": "tensorzero/tensorzero",
      "repo_url": "https://github.com/tensorzero/tensorzero",
      "description": "TensorZero creates a feedback loop for optimizing LLM applications \u2014 turning production data into smarter, faster, and cheaper models.",
      "score": 4,
      "signals": {
        "commit_surge": 3,
        "star_velocity": 0,
        "team_traction": 0,
        "dev_ecosystem_fit": 1
      },
      "ecosystem": "Backend",
      "language": "Rust",
      "stars": 6302,
      "forks": 389,
      "why_matters": "84 commits \u2022 rust language",
      "created_at": "",
      "topics": [],
      "score_change": null,
      "trend": [
        4
      ]
    },
    {
      "name": "agent-zero",
      "full_name": "frdel/agent-zero",
      "repo_url": "https://github.com/frdel/agent-zero",
      "description": "Agent Zero AI framework",
      "score": 3,
      "signals": {
        "commit_surge": 2,
        "star_velocity": 0,
        "team_traction": 0,
        "dev_ecosystem_fit": 1
      },
      "ecosystem": "Other",
      "language": "Python",
      "stars": 9529,
      "forks": 1859,
      "why_matters": "38 commits \u2022 python language",
      "created_at": "",
      "topics": [],
      "score_change": null,
      "trend": [
        3
      ]
    },
    {
      "name": "netbird",
      "full_name": "netbirdio/netbird",
      "repo_url": "https://github.com/netbirdio/netbird",
      "description": "Connect your devices into a secure WireGuard\u00ae-based overlay network with SSO, MFA and granular access controls.",
      "score": 3,
      "signals": {
        "commit_surge": 3,
        "star_velocity": 0,
        "team_traction": 0,
        "dev_ecosystem_fit": 0
      },
      "ecosystem": "Backend",
      "language": "Go",
      "stars": 15372,
      "forks": 725,
      "why_matters": "36 commits",
      "created_at": "",
      "topics": [],
      "score_change": null,
      "trend": [
        3
      ]
    }
  ]
}