{
  "name": "Venture-Grade OSS Signals Report \u2014 2025-07-15",
  "repositories": [
    {
      "name": "genai-toolbox",
      "full_name": "googleapis/genai-toolbox",
      "url": null,
      "description": "MCP Toolbox for Databases is an open source MCP server for databases.",
      "score": 0.0,
      "signals": {
        "star_velocity": 0.0,
        "fork_velocity": 0.0,
        "contributor_growth": 0.0,
        "issue_resolution_rate": 0.20689655172413793,
        "commit_frequency": 0.0,
        "novelty_signal": 0.0,
        "founder_signal": 0.0,
        "documentation_quality": 0.0
      },
      "justification": [],
      "metrics": {
        "stars": 0,
        "stars_gained_14d": 0,
        "forks": 0,
        "forks_gained_14d": 0,
        "commits_14d": 0,
        "contributors_30d": 0,
        "avg_issue_resolution_days": 30
      },
      "date_analyzed": "2025-07-15T11:03:39Z",
      "why_matters": "\u2022 star_velocity: 0.0 \u2022 fork_velocity: 0.0 \u2022 contributor_growth: 0.0 \u2022 issue_reso",
      "repo_url": "https://github.com/googleapis/genai-toolbox",
      "stars": 0,
      "forks": 0,
      "ecosystem": "Other",
      "language": "N/A"
    },
    {
      "name": "WebAgent",
      "full_name": "Alibaba-NLP/WebAgent",
      "url": null,
      "description": "\ud83c\udf10 WebAgent for Information Seeking built by Tongyi Lab: WebWalker & WebDancer & WebSailorhttps://arxiv.org/pdf/2507.02592",
      "score": 0.0,
      "signals": {
        "star_velocity": 0.0,
        "fork_velocity": 0.0,
        "contributor_growth": 0.0,
        "issue_resolution_rate": 0.20689655172413793,
        "commit_frequency": 0.0,
        "novelty_signal": 0.0,
        "founder_signal": 0.0,
        "documentation_quality": 0.0
      },
      "justification": [],
      "metrics": {
        "stars": 0,
        "stars_gained_14d": 0,
        "forks": 0,
        "forks_gained_14d": 0,
        "commits_14d": 0,
        "contributors_30d": 0,
        "avg_issue_resolution_days": 30
      },
      "date_analyzed": "2025-07-15T11:03:39Z",
      "why_matters": "\u2022 star_velocity: 0.0 \u2022 fork_velocity: 0.0 \u2022 contributor_growth: 0.0 \u2022 issue_reso",
      "repo_url": "https://github.com/Alibaba-NLP/WebAgent",
      "stars": 0,
      "forks": 0,
      "ecosystem": "Other",
      "language": "N/A"
    },
    {
      "name": "rustfs",
      "full_name": "rustfs/rustfs",
      "url": null,
      "description": "\ud83d\ude80 High-performance distributed object storage for MinIO alternative.",
      "score": 0.0,
      "signals": {
        "star_velocity": 0.0,
        "fork_velocity": 0.0,
        "contributor_growth": 0.0,
        "issue_resolution_rate": 0.20689655172413793,
        "commit_frequency": 0.0,
        "novelty_signal": 0.0,
        "founder_signal": 0.0,
        "documentation_quality": 0.0
      },
      "justification": [],
      "metrics": {
        "stars": 0,
        "stars_gained_14d": 0,
        "forks": 0,
        "forks_gained_14d": 0,
        "commits_14d": 0,
        "contributors_30d": 0,
        "avg_issue_resolution_days": 30
      },
      "date_analyzed": "2025-07-15T11:03:39Z",
      "why_matters": "\u2022 star_velocity: 0.0 \u2022 fork_velocity: 0.0 \u2022 contributor_growth: 0.0 \u2022 issue_reso",
      "repo_url": "https://github.com/rustfs/rustfs",
      "stars": 0,
      "forks": 0,
      "ecosystem": "Other",
      "language": "N/A"
    }
  ],
  "date": "2025-07-15",
  "date_generated": "2025-07-15T11:03:39Z"
}