{
  "name": "Venture-Grade OSS Signals Report \u2014 2025-06-19",
  "repositories": [
    {
      "name": "awesome-llm-apps",
      "full_name": "Shubhamsaboo/awesome-llm-apps",
      "url": null,
      "description": "Collection of awesome LLM apps with AI Agents and RAG using OpenAI, Anthropic, Gemini and opensource models.",
      "score": 0.0,
      "signals": {
        "star_velocity": 0.0,
        "fork_velocity": 0.0,
        "contributor_growth": 0.0,
        "issue_resolution_rate": 0.20689655172413793,
        "commit_frequency": 0.0,
        "novelty_signal": 0.0,
        "founder_signal": 0.0,
        "documentation_quality": 0.0
      },
      "justification": [],
      "metrics": {
        "stars": 0,
        "stars_gained_14d": 0,
        "forks": 0,
        "forks_gained_14d": 0,
        "commits_14d": 0,
        "contributors_30d": 0,
        "avg_issue_resolution_days": 30
      },
      "date_analyzed": "2025-06-19T16:26:21Z",
      "why_matters": "\u2022 star_velocity: 0.0 \u2022 fork_velocity: 0.0 \u2022 contributor_growth: 0.0 \u2022 issue_reso",
      "repo_url": "https://github.com/Shubhamsaboo/awesome-llm-apps",
      "ecosystem": "Other",
      "language": "N/A",
      "stars": 0,
      "forks": 0
    },
    {
      "name": "jan",
      "full_name": "menloresearch/jan",
      "url": null,
      "description": "Jan is an open source alternative to ChatGPT that runs 100% offline on your computer",
      "score": 0.0,
      "signals": {
        "star_velocity": 0.0,
        "fork_velocity": 0.0,
        "contributor_growth": 0.0,
        "issue_resolution_rate": 0.20689655172413793,
        "commit_frequency": 0.0,
        "novelty_signal": 0.0,
        "founder_signal": 0.0,
        "documentation_quality": 0.0
      },
      "justification": [],
      "metrics": {
        "stars": 0,
        "stars_gained_14d": 0,
        "forks": 0,
        "forks_gained_14d": 0,
        "commits_14d": 0,
        "contributors_30d": 0,
        "avg_issue_resolution_days": 30
      },
      "date_analyzed": "2025-06-19T16:26:21Z",
      "why_matters": "\u2022 star_velocity: 0.0 \u2022 fork_velocity: 0.0 \u2022 contributor_growth: 0.0 \u2022 issue_reso",
      "repo_url": "https://github.com/menloresearch/jan",
      "ecosystem": "Other",
      "language": "N/A",
      "stars": 0,
      "forks": 0
    },
    {
      "name": "youtube-transcript-api",
      "full_name": "jdepoix/youtube-transcript-api",
      "url": null,
      "description": "This is a python API which allows you to get the transcript/subtitles for a given YouTube video. It also works for automatically generated subtitles and it does not require an API key nor a headless browser, like other selenium based solutions do!",
      "score": 0.0,
      "signals": {
        "star_velocity": 0.0,
        "fork_velocity": 0.0,
        "contributor_growth": 0.0,
        "issue_resolution_rate": 0.20689655172413793,
        "commit_frequency": 0.0,
        "novelty_signal": 0.0,
        "founder_signal": 0.0,
        "documentation_quality": 0.0
      },
      "justification": [],
      "metrics": {
        "stars": 0,
        "stars_gained_14d": 0,
        "forks": 0,
        "forks_gained_14d": 0,
        "commits_14d": 0,
        "contributors_30d": 0,
        "avg_issue_resolution_days": 30
      },
      "date_analyzed": "2025-06-19T16:26:21Z",
      "why_matters": "\u2022 star_velocity: 0.0 \u2022 fork_velocity: 0.0 \u2022 contributor_growth: 0.0 \u2022 issue_reso",
      "repo_url": "https://github.com/jdepoix/youtube-transcript-api",
      "ecosystem": "Other",
      "language": "N/A",
      "stars": 0,
      "forks": 0
    },
    {
      "name": "vggt",
      "full_name": "facebookresearch/vggt",
      "url": null,
      "description": "[CVPR 2025 Best Paper Award] VGGT: Visual Geometry Grounded Transformer",
      "score": 0.0,
      "signals": {
        "star_velocity": 0.0,
        "fork_velocity": 0.0,
        "contributor_growth": 0.0,
        "issue_resolution_rate": 0.20689655172413793,
        "commit_frequency": 0.0,
        "novelty_signal": 0.0,
        "founder_signal": 0.0,
        "documentation_quality": 0.0
      },
      "justification": [],
      "metrics": {
        "stars": 0,
        "stars_gained_14d": 0,
        "forks": 0,
        "forks_gained_14d": 0,
        "commits_14d": 0,
        "contributors_30d": 0,
        "avg_issue_resolution_days": 30
      },
      "date_analyzed": "2025-06-19T16:26:21Z",
      "why_matters": "\u2022 star_velocity: 0.0 \u2022 fork_velocity: 0.0 \u2022 contributor_growth: 0.0 \u2022 issue_reso",
      "repo_url": "https://github.com/facebookresearch/vggt",
      "ecosystem": "Other",
      "language": "N/A",
      "stars": 0,
      "forks": 0
    },
    {
      "name": "prompt-optimizer",
      "full_name": "linshenkx/prompt-optimizer",
      "url": null,
      "description": "\u4e00\u6b3e\u63d0\u793a\u8bcd\u4f18\u5316\u5668\uff0c\u52a9\u529b\u4e8e\u7f16\u5199\u9ad8\u8d28\u91cf\u7684\u63d0\u793a\u8bcd",
      "score": 0.0,
      "signals": {
        "star_velocity": 0.0,
        "fork_velocity": 0.0,
        "contributor_growth": 0.0,
        "issue_resolution_rate": 0.20689655172413793,
        "commit_frequency": 0.0,
        "novelty_signal": 0.0,
        "founder_signal": 0.0,
        "documentation_quality": 0.0
      },
      "justification": [],
      "metrics": {
        "stars": 0,
        "stars_gained_14d": 0,
        "forks": 0,
        "forks_gained_14d": 0,
        "commits_14d": 0,
        "contributors_30d": 0,
        "avg_issue_resolution_days": 30
      },
      "date_analyzed": "2025-06-19T16:26:21Z",
      "why_matters": "\u2022 star_velocity: 0.0 \u2022 fork_velocity: 0.0 \u2022 contributor_growth: 0.0 \u2022 issue_reso",
      "repo_url": "https://github.com/linshenkx/prompt-optimizer",
      "ecosystem": "Other",
      "language": "N/A",
      "stars": 0,
      "forks": 0
    }
  ],
  "date": "2025-06-19",
  "date_generated": "2025-06-19T12:26:21Z"
}